{
  "mission_id": "urn:noosfera:mission:00000000-0000-4000-8000-000000000001",
  "sequence": 1,
  "event_type": "mission.received",
  "payload": {"document_count": 1},
  "event_hash": "0000000000000000000000000000000000000000000000000000000000000000",
  "previous_receipt_hash": "0000000000000000000000000000000000000000000000000000000000000000",
  "receipt_hash": "1111111111111111111111111111111111111111111111111111111111111111",
  "created_at": "2026-08-25T18:00:00Z"
}
